{
  "id": "look_around",
  "version": 1,
  "category": "perception",
  "summary": "Turn through a short fixed sweep and come back to the starting heading, head level.",
  "parameters": {},
  "preconditions": [],
  "expectedEffects": [
    {
      "fact": "surveyed",
      "op": "=",
      "value": 1
    }
  ],
  "possibleFailures": ["threat_appeared", "timed_out"],
  "requiredPermissions": [],
  "costLimits": {
    "maxTicks": 200,
    "maxDistance": 0,
    "minHealth": 0
  },
  "interruptionPolicy": "preemptible",
  "completionEvidence": ["elapsed_ticks"],
  "risk": 0.02,
  "emergency": false
}
