{
  "id": "gather_wood",
  "version": 1,
  "category": "resources",
  "summary": "Harvest logs from permitted trees within range.",
  "parameters": {
    "target_amount": {
      "type": "integer",
      "minimum": 1,
      "maximum": 64,
      "default": 8
    },
    "max_distance": {
      "type": "integer",
      "minimum": 4,
      "maximum": 128,
      "default": 48
    }
  },
  "preconditions": [
    {
      "fact": "reachable_wood",
      "op": ">=",
      "value": 1
    },
    {
      "fact": "harvesting_permitted",
      "op": "==",
      "value": 1
    },
    {
      "fact": "inventory_space",
      "op": ">=",
      "value": 1
    }
  ],
  "expectedEffects": [
    {
      "fact": "wood",
      "op": "+=",
      "value": 8,
      "scalesWith": "target_amount"
    },
    {
      "fact": "building_materials",
      "op": "+=",
      "value": 8,
      "scalesWith": "target_amount"
    },
    {
      "fact": "fuel",
      "op": "+=",
      "value": 8,
      "scalesWith": "target_amount"
    }
  ],
  "possibleFailures": [
    "unreachable_resource",
    "inventory_full",
    "interrupted_by_threat",
    "no_yield",
    "timed_out"
  ],
  "requiredPermissions": ["harvest_resource"],
  "costLimits": {
    "maxTicks": 2400,
    "maxDistance": 64,
    "minHealth": 6
  },
  "interruptionPolicy": "preemptible",
  "completionEvidence": ["inventory_delta", "harvested_blocks"],
  "risk": 0.2,
  "emergency": false
}
