{
  "id": "mine_stone",
  "version": 1,
  "category": "resources",
  "summary": "Mine permitted stone with a pickaxe.",
  "parameters": {
    "target_amount": {
      "type": "integer",
      "minimum": 1,
      "maximum": 64,
      "default": 8
    },
    "max_distance": {
      "type": "integer",
      "minimum": 4,
      "maximum": 128,
      "default": 48
    }
  },
  "preconditions": [
    {
      "fact": "reachable_stone",
      "op": ">=",
      "value": 1
    },
    {
      "fact": "tool_tier",
      "op": ">=",
      "value": 1
    },
    {
      "fact": "harvesting_permitted",
      "op": "==",
      "value": 1
    },
    {
      "fact": "inventory_space",
      "op": ">=",
      "value": 1
    }
  ],
  "expectedEffects": [
    {
      "fact": "stone",
      "op": "+=",
      "value": 8,
      "scalesWith": "target_amount"
    },
    {
      "fact": "building_materials",
      "op": "+=",
      "value": 8,
      "scalesWith": "target_amount"
    }
  ],
  "possibleFailures": [
    "unreachable_resource",
    "missing_tool",
    "inventory_full",
    "no_yield",
    "timed_out"
  ],
  "requiredPermissions": ["mine_resource"],
  "costLimits": {
    "maxTicks": 3000,
    "maxDistance": 64,
    "minHealth": 8
  },
  "interruptionPolicy": "preemptible",
  "completionEvidence": ["inventory_delta", "harvested_blocks"],
  "risk": 0.25,
  "emergency": false
}
